result_id,event_title,edition,edition_id,sport,sport_url,result_date,result_location,result_participants,result_format,result_detail,result_description
320126,"Two Person Dinghy (470), Men",2012 Summer Olympics,54,Sailing,/editions/54/sports/SAL,2 – 10 August 2012,"Weymouth and Portland National Sailing Academy, Isle of Portland",54 from 27 countries,Points awarded for placement in each race.  Best 10 of 11 scores to count for N. N count double.,na,"The pre-Olympic favorites were Australians Mathew Belcher and Malcolm Page. They had moved to first in the ISAF 470 rankings in 2007 and had been World Champions and World Cup champions in 2011. Page had won a gold medal in this event in 2008, then partnered by Nathan Wilmot. But the event was close, as they were pushed throughout by hometown favorites Luke Patience and Stuart Bithell. The Australians had a four-point lead going into the medal race, and tried to force the Brits into a poor start but without success. On the final leg, the British crew was penalized for illegally trimming their sails for extra speed, which allowed Australia to come home in second and win the gold medal, with Great Britain taking silver. This was the third consecutive silver medal in the event for Great Britain. Australia had also won this event in 2008 and 2012. The bronze went to the Argentine crew of Lucas Calabrese and Juan de la Fuente.
"
19017080,"Foil, Team, Women",2020 Summer Olympics,61,Fencing,/editions/61/sports/FEN,29 July 2021,"Makuhari Messe, 2-1, Nakase, Mihama-ku, Chiba, Chiba Prefecture, Japan",32 from 8 countries,Single-elimination tournament.,na,"The reigning World Champion Russia, now represented by the Russian Olympic Committee officially, clearly won the final against France by a 45-34 win. The semi-finals were very close, as the Russians beat Italy by a 45-43 and the United States lost to Russian Olympic Committee 45-42. Italy then dominated the US fencers in the bronze match by 45-23.
"
30314,"Lightweight (≤69 kilograms), Men",2004 Summer Olympics,26,Weightlifting,/editions/26/sports/WLF,"18 August 2004 — 10:30 (A), 20:00 (B)","Olympiako Gymnastirio Arsis Varon Nikaias, Nikaia",17 from 16 countries,Total of best lifts in snatch and clean & jerk determined placement.  Ties broken by lightest bodyweight.,na,"China’s Zhang Guozheng was the heavy favorite after winning the 2002-03 World Championships. He took the lead in the snatch with 160.0 kg, and then lifted 187.5 kg. However, Korean Lee Bae-Yeong bettered his clean & jerk with 190.0 kg, and attempted 195.0 kg, which would have won the gold medal based on bodyweight, but he missed it, settling for silver. Croatian Nikolay Peshalov won the bronze medal, which made him only the third Olympic weightlifter to win four medals, after American Norb Schemansky (1948-64) and German Ronny Weller (1988-2000), a mark that would later be equalled at Athinai by Greek Pyrros Dimas (1992-2004).
"
185024,"Individual, Men",1912 Summer Olympics,6,Equestrian Jumping,/editions/6/sports/EJP,16 July 1912 — 14:00,"Stockholms Olympiastadion, Stockholm",31 from 8 countries,One round.  Maximum points 190.,na,"There were 15 obstacles, with four of them jumped twice, or a total of 19 obstacles.  Ten points were given for each obstacle cleared.  The maximum height of the jumps was 1.4 metres.  The water jump was 4.0 metres in length.  Deductions were as follows:  1st refusal - 2 points; 2nd refusal - 4 points; 3rd refusal - 6 points; fall from horse - 6 points; hitting fence with horse’s foreleg - 1 point; hitting fence with horse’s hindleg - 1 point; knocking down a fence with the horse’s foreleg - 4 points; knocking down a fence with the horse’s hindleg - 2 points; hitting the water with the horse’s hindleg - 2 points; hitting the water with the horse’s foreleg - 4 points; and exceeding the time limit - 2 points for each 5-second interval beyong the time limit.  The course was 1,533 metres in length, and the time limit was 3:50.0, for a calculated speed of 400 metres/minute.
Jean Cariou (FRA) tied for first place with Rabod Wilhelm von Kröcher (GER) with four faults, or a score of 186.  In the jump-off, shortened to six obstacles (maximum score of 60), Cariou had five faults to seven for von Kröcher.  Of interest, Cariou had competed in the three-day event, finishing third in the individual.  He had the highest total score in sections 1-3, and 5, but was brought down by his performance in the jumping section, where he finished 15th of 19 competitors.  Cariou won the Count Géza Andrassy (HUN) Challenge Prize, in addition to his gold medal.
"
2108,"10 kilometres (Classical), Women",2002 Winter Olympics,47,Cross Country Skiing,/editions/47/sports/CCS,12 February 2002 — 9:00,"Soldier Hollow, Wasatch Mountain State Park",61 from 23 countries,na,"Course Length: 10,132 mHeight Differential: 119 mIntermediate 1: 2.0 kmIntermediate 2: 5.8 kmIntermediate 3: 8.7 kmMaximum Climb: 70 mTotal Climbing: 382 m","The heavy favorite in this race was Norway’s Bente Skari-Martinsen. She was World Champion at this distance in 2001, at 15 km in 2001, and at 5 km in 1999. She had won the 1998-99 and 1999-2000 World Cup and would win it again in 2001-02, after placing second in 2000-01. She would also win the sprint World Cup in 2001-02, for the fifth consecutive season. But early in the race, Skari-Martinsen was well behind Russian Olga Danilova. Danilova led by over 15 seconds at 5.8 km, but Skari-Martinsen had closed to within 10 seconds at 8.7 km. And then she blasted to the finish, defeating Danilova to win by 2½ seconds, as expected, though it had not been easy. The bronze medal went to Danilova’s teammate Yuliya Chepalova, the 2000-01 World Cup champion. Fourth was another Russian, Larisa Lazutina.
But that podium didn’t last. Skari-Martinsen won the gold medal. But Danilova and Lazutina would eventually be disqualified when it was revealed they had tested positive for darpopoietin, an erythropoietin analogue. This was not revealed, however, until October 2003, for Danilova, and two months later for Lazutina. Chepalova was moved up to the silver medal, while fifth-place finisher Stefania Belmondo was awarded the bronze medal. In 2003 Skari-Martinsen would win the event at the World Championships.
"
29129,"Middleweight (≤75 kilograms), Men",1956 Summer Olympics,14,Weightlifting,/editions/14/sports/WLF,24 November 1956 — 20:00,"Royal Exhibition Building, Melbourne, Victoria",16 from 15 countries,"Total of best lifts in military press, snatch, and clean & jerk determined placement.  Ties broken by lightest bodyweight.",na,"American Pete George was the defending gold medalist, and had won silver in this class in 1948. He was World Champion in 1954 and 1955 and in 1953 had won the World title as a lightweight. He came to Melbourne as a slight favorite over Soviet lifter Fyodor Bogdanovsky, who had been second to George at the 1954-55 World Championships and held the world record. Bogdanovsky put George away early, with an Olympic record press of 132.5 kg, giving him a 10 kg lead, and George could never catch up, despite outlifting Bogdanovsky in the snatch. Bogdanovsky bettered his world record with 420.0 kg as George won the silver medal. The bronze medal went to Italian Ermano Pignatti, who had been 1951 European Champion and had won bronze medals at the 1952-53 Europeans and a silver medal in 1954. George’s brother, Jim, won a bronze medal in light-heavyweight weightlifting at Melbourne and would improve to a silver medal in that class at Rome in 1960.
"
8665,"200 metres Butterfly, Women",2000 Summer Olympics,25,Swimming,/editions/25/sports/SWM,19 – 20 September 2000,"Sydney International Aquatic Centre, Olympic Park, Sydney, New South Wales",36 from 27 countries,na,na,"To Australians Susie O’Neill was “Madame Butterfly”, the outstanding butterfly swimmer in the world over the years between Atlanta and Sydney and one of her nation’s most popular sports personalities. She was an odds-on favourite to win the Olympic title in front of her crowd and, if that wasn’t enough to satisfy Australian hopes, her closest rival appeared to be team-mate Petria Thomas. To add to the excitement the world record holder had already won gold in her “bonus event”, the 200 metre freestyle.
But the script did not go to plan. America’s Misty Hyman took the lead from the gun, held onto the lead, and despite intense pressure from O’Neill and Thomas over the last length, came home to produce one of the most shocking upsets in swimming history. O’Neill had been beaten in the event for the first time in six years in front of her own fans in an Olympic final. Hyman’s immediate response was simply to shout “Oh my God!” a dozen times whilst punching the air.
"
58142,"Javelin Throw, Women",1932 Summer Olympics,10,Athletics,/editions/10/sports/ATH,31 July 1932 — 17:30,"Los Angeles Memorial Coliseum, Los Angeles, California",8 from 4 countries,Final only.,na,"The Germans were the early leaders in this event with Liesel Schumann winning the 1930 FSFI Women’s World Games, and Ellen Braumüller setting three world records from 1930-32. In June 1932, American Nan Gindele broke the world record, throwing 46.745 (153-4) at the Central AAU Championships. But she was not considered the best American, that role falling to Babe Didrikson who had won the AAU title in 1930 and 1932, and also the baseball throw consecutively from 1930-32, with her 1931 winning mark of 296-0 (90.22) still considered the women’s world record in that now rarely contested event. Didrikson was considered the greatest female athlete in the world, and she would dominate the 1932 Olympics athletics, winning two gold and one silver medal. Her first event was the javelin and she came thru to win with her first round throw of 43.68 (143-3¾). Braumüller was a close second with her teammates, Tilly Fleischer winning bronze. Gindele was a non-competitive fifth.
"
62947,"Decathlon, Men",1984 Summer Olympics,21,Athletics,/editions/21/sports/ATH,8 –  9 August 1984,"Los Angeles Memorial Coliseum, Los Angeles, California",26 from 18 countries,Scoring by 1962/1977 point tables.,na,"By 1984 the defending gold medalist, Daley Thompson, was dominant in the decathlon. He had not lost a decathlon since the 1978 European Championships, winning the 1982 European and Commonwealth titles, and was 1984 World Champion. But his victory in Los Angeles was not a foregone conclusion. Thompson no longer held the world record, that mark having been broken three times since 1982 by West German Jürgen Hingsen. Hingsen’s teammates, Siggi Wentz and 1976 silver medalist Guido Kratschmer were also expected to push Thompson. The Soviet-led boycott had minimal effect in 1984, with East German Siegfried Stark the only top international decathlete absent. Despite the German threat, Thompson was superb. He won the first two events, the 100 and long jump, with 10.44 and 8.01 and opened up a lead he never relinquished. He led Hingsen by 210 points after the javelin and coasted in the 1,500 to win the gold medal. Hingsen, Wentz, and Kratschmer finished second, third, and fourth. Thompson’s original mark of 8,797 missed Hingsen’s world record by one point, but a re-read of the photo finishes converted it to 8,798 and equal to Hingsen’s mark. Then in 1985, new decathlon tables were introduced and Thompson’s converted mark became 8,847 and the world record.
"
158943,"Coxed Pairs, Men",1984 Summer Olympics,21,Rowing,/editions/21/sports/ROW,31 July –  5 August 1984,"Lake Casitas, Los Padres National Forest, California",36 from 12 countries,na,na,"Due to the Soviet-led boycott, the reigning Olympic and World Champion in the coxed pairs, East Germany, was not present at the 1984 Summer Olympics. This meant that the favorites in the event, the two-time World Championship-winning Italians Giuseppe Di Capua and brothers Carmine and Giuseppe Abbagnale, were likely to go unchallenged in Los Angeles. The only other World Championship medalist from the past three years at the Games was Great Britain, bronze medalists in 1981, and they sent a new lineup consisting of Adrian Genziani, Bill Lang, and Alan Inns.
The Italians won their heat with ease in the opening round, but were actually slightly slower than the other heat winners, Romanians Dimitrie Popescu, Vasile Tomoiagă, and Dumitru Răducanu, who had been tapped as having an advantage in the rowing events with the absence of the Eastern Bloc. In the final, however, Italy was unquestionably dominant, winning gold by a margin of over five seconds over Romania, who settled for silver. The United States, meanwhile, represented by Kevin Still, Robert Espeseth, Jr., and Doug Herland, took bronze by almost the same margin over the Brazilians.
"
350452,"Large Hill, Individual, Men",2014 Winter Olympics,58,Ski Jumping,/editions/58/sports/SJP,14 – 15 February 2014,"Kompleks Dlya Pryzhkov Na Lyzhakh s Tramplina ""Russkiye Gorki"", Mountain Cluster, Esto-Sadok",61 from 20 countries,na,NOR,"As on the normal hill, Austrian Michael Hayböck was the leader in the qualifying round, but he again walked away empty-handed after the final. Wind conditions proved to be difficult to handle for the top athletes who were seeded directly into the final. The strong, fluctuating winds resulted in high figures for the newly introduced wind compensation factor. After the first round, Kamil Stoch from Poland, who had already won the gold medal on the normal hill a few days prior, was again leading the field with 139.0 m and a score of 143.4 points after what turned out to be the best jump of the competition. A surprise second was Japanese veteran Noriaki Kasai, competing in his record seventh Olympics, with the same distance but a slightly lower score, leading German Severin Freund by just 0.4 points.
In the second round, German Marinus Kraus, way behind in the intermediate ranking, had a jump of 140.0 m to take the lead. The next to beat his overall score was Norwegian Anders Fannemel, who eventually placed fifth, behind German Severin Freund in fourth place. Slovenian Peter Prevc, silver medalist on the normal hill, was next to take the lead with the best jump of the second round. As the penultimate jumper, Kasai made a jump of 133.5 m, taking the lead with a combined score of 277.4. Stoch’s final jump of 132.5 m and 135.3 points was only the fourth best of the final round. After a moment of uncertainty, the Pole was declared the winner by 1.3 points to win his second gold medal of the Games even though Kasai jumped one meter further over the two rounds. Stoch became the third man to win both individual ski jumping events at one edition of the Olympic Winter Games after Finn Matti Nykänen (1988) and Swiss Simon Ammann (2002 and 2010). Kasai won the silver, his second medal 20 years after a silver in the 1994 team event at Lillehammer, and Prevc the bronze medal.
Potential medal contenders Thomas Morgenstern (AUT), Robert Kranjec (SLO), Thomas Diethart (AUT) and Andreas Wellinger (GER) failed to qualify for the final round, finishing outside the top 30. Simon Ammann, double gold medalist in 2002 and 2010, finished a disappointing 23rd.
"
18747,"Heavyweight (>100 kilograms), Men",2000 Summer Olympics,25,Judo,/editions/25/sports/JUD,22 September 2000 — 15:00-18:30-20:30-22:00,"Sydney Exhibition Centre, Sydney Convention and Exhibition Centre, Sydney, New South Wales (Hall 1 & 2)",32 from 32 countries,"Two single-elimination pools, with winner of each pool advanced to the final. All judoka losing to the finalists in each pool advanced to repêchage pools, with the winners of the repêchage pools earning bronze medals.",na,"Two judokas were expected to contest the gold medal. David Douillet (FRA) was the defending gold medalist and had won four World Championships. In the 1997 World final, he defeated Japan’s Shinichi Shinohara on a disputed penalty. But with Douillet absent because of a back injury in 1999, Shinohara won the World titles in both heavyweight and open class. Everything went according to form in Sydney and they advanced to the final with little opposition. The final match between the two again saw controversy. At 1:20, Douillet attempted a leg throw, but when Shinohara countered they both fell to the mat, with Douillet landing on his back. One judge ruled ippon for Shinohara, which would have given him the match, but other two ruled yuko for Douillet. The match was tied until the last minute, when Douillet scored a yuko, and he eventually won by yusei-gachi. The Japanese protested but it was not allowed. Shinohara later became a Japanese collegiate judo coach.
"
64082,"3,000 metres Steeplechase, Men",1992 Summer Olympics,23,Athletics,/editions/23/sports/ATH,3 –  7 August 1992,"Estadio Olímpico de Montjuïc, Barcelona",32 from 23 countries,na,na,"By now the Kenyans were established the dominant nation in the steeplechase. Though their distance runners were excellent at all distances, this seemed to be the race they had chosen as “their own.” Kenyans had won the last two Olympic gold medals, and won in 1968-72, won four of the last five Commonwealth Games, and in 1991 Moses Kiptanui had won the World Championships, his first of three consecutive. But Kiptanui seemed off form in 1992 and was not chosen for the Kenyan steeplechase team at Barcelona, after finishing fourth at the Kenyan Olympic Trials. Offered a chance to run in the Olympics because of his dominance, he demurred rather than bumping the third-place finisher, his friend, William Mutwol. Kiptanui’s absence mattered little as Kenya achieved their first medal sweep in the steeplechase. The race was won by Matthew Birir, the World Junior Champion and junior world record holder. He, Patrick Sang, and Mutwol were chased on the last lap by Italy’s Alessandro Lambruschini but he fell off the pace at the water jump. Birir finished easily in the lead, turning his head several times on the final straight to check his position. This was the third medal sweep in the steeplechase, having been achieved in 1928 by Finland and 1948 by Sweden. A few weeks after the Olympics, Moses Kiptanui broke the world record, running 8:02.08 at the Weltklasse Meet in Zürich.
"
900722,"Finweight (≤ 43 kilograms), Women",1988 Summer Olympics,22,Taekwondo,/editions/22/sports/TKW,19 September 1988,"Jang-chung Che-yuk-gwan, Seoul",8 from 8 countries,na,na,"Eight fighters competed in a single-elimination tournament. The event was won by Chin Yu-Fang of Chinese Taipei, who had been a bronze medalist at the 1987 World Championship. Chin won the title by defeating Korean Lee Hwa-Jin in the final on points. Chin would later win the World title in 1989.
"
26718,"Light-Welterweight (≤63.5 kilograms), Men",1996 Summer Olympics,24,Boxing,/editions/24/sports/BOX,24 July –  4 August 1996,"Alexander Memorial Coliseum, Atlanta, Georgia",32 from 32 countries,Single elimination tournament.,na,"Since before the Barcelona Games the 1992 Olympic Champion Héctor Vinent of Cuba had reigned supreme in the light-welterweight division and had won both the 1993 and 1995 World Championship titles. His only major defeat during this period was at the 1995 Pan-American Games in Argentina where he lost a debatable decision to the host nation’s Walter Crucce.  Crucce did not compete in Atlanta as he decided to pursue a career as a professional in late 1995.
Vinent started his campaign with a knockout victory then had three successive easy points wins which yielded an aggregate points score of 63 against 14. In the opposite corner for the gold medal bout was Oktay Urkal, A German of Turkish heritage, who had been crowned European champion earlier in the year.  The Cuban used his reach advantage to pick off the onrushing Urkal and, when the German threatened to take advantage on the inside, Vinent returned his punches with interest. He fought on for another four years in the hope of winning a third Olympic gold in Sydney but failed to make the Olympic team in 2000
"
10106,"Windsurfer (Windglider), Men",1984 Summer Olympics,21,Sailing,/editions/21/sports/SAL,31 July –  8 August 1984,"Long Beach Marina, Long Beach, California (Alpha Course)",38 from 38 countries,Points awarded for placement in each race.  Best six of seven scores to count for final placement.,na,"This was the first time windsurfing was held at the Olympics and it was open only to men, the first time that an Olympic yachting event had not been contested as a mixed class. Men and women also had a windsurfing demonstration event in 1984. The board chosen in 1984 was the windglider. It had been designed in Europe and was chosen over the Windsurfer One, designed in America by Hoyle Schwitzer, which was used for the men’s and women’s demonstration event. The windglider would never be used again for Olympic windsurfing. The windsurfers raced over the Alpha course in the Long Beach Harbor.
The first gold medal in windsurfing went to Dutchman Stephan van den Berg, who won only one race, but was consistent, not having to count any race finish higher than fourth. Silver medalist Scott Steele of the United States was competing in his only Olympics. The bronze medalist, Bruce Kendall of New Zealand, would win this event in 1988. His sister, Barbara, was one the world’s top women windsurfers and won a full set of Olympic medals in the women’s event at the 1992-2000 Olympics, including gold in 1992.
Van Den Berg had won four world titles (1980-83) on the Windglider, the first three in the Light division, which was eliminated in 1983. He turned professional after the Olympics, but returned in 1992 when pros were allowed to compete.
"
10184,"One Person Dinghy (Finn), Open",1988 Summer Olympics,22,Sailing,/editions/22/sports/SAL,20 – 27 September 1988,"Busan Yachting Center, Busan (Course Alpha)",33 from 33 countries,Points awarded for placement in each race.  Best six of seven scores to count for final placement.,na,"This Finn event came down to the last race. Spain’s José Luis Doreste finished only third in the race, but it was good enough for the gold medal when Peter Holmberg of the United States Virgin Islands finished only second. Doreste had been disqualified in the fourth race and was upset with his opponents, accusing them of trying to win “in the jury room” instead of on the water. In that race, Holmberg had gone over the starting line and the premature start dropped him to last-place points, eventually depriving him of the gold medal. Doreste’s brother, Luis Doreste, had won a gold medal in the 470 class at the 1984 Los Angeles Olympics. Holmberg’s silver was the first Olympic medal won by the U.S. Virgin Islands.
In race five of the Finn class, Joseph Chan of Singapore, who was racing concurrently in the 470 class, went overboard and was being swept away by the currents, unable to resist much because of a back injury. He was rescued by Canada’s Finn entrant Lawrence Lemieux, who had been in second place when he saw Chan struggling in the water, but deviated from his course to rescue him. Lemieux eventually finished 11th in the class, but was awarded the points for a second place position in race five, his placement when he left for the rescue. For his actions, he was given the Pierre de Coubertin Award by the IOC.
"
19019631,"12.5 kilometres Pursuit, Men",2022 Winter Olympics,62,Biathlon,/editions/62/sports/BTH,13 February 2022 — 18:45,"Zhangjiakou Nordic Centre and Biathlon Centre, Chongli District, Zhangjiakou City, Hebei Province",59 from 22 countries,Starting margin based on results of 10 kilometer. Penalty loop (150 metres) skied for each missed target.,na,"Quentin Fillon Maillet of France won the men’s biathlon pursuit for his fourth medal and second gold medal at Beijing 2022. He started as favourite, having won four of five pursuit races in the 2021/22 season. The Beijing race took place in difficult weather conditions, but Fillon Maillet made no mistakes in heavy snowfall, bitterly cold temperatures (-14°C), and icy winds in the Zhangjiakou National Biathlon Centre.
The silver medal went to Tarjei Bø (+28.6 seconds), and bronze went to Eduard Latypov (+35.3 seconds), both with one penalty. Latypov was ahead of Bø for most of the race but lost 15.9 seconds on the last loop and had to settle for bronze.
Tarjei’s brother, Johannes Thingnes Bø, who started with a comfortable lead of 41.0 seconds after the sprint, experienced an unfortunate race. In his third round of shooting, he had the worst of the conditions. In total, the 28-year-old went into the penalty loop seven times (0-2-3-2). However, because of his outstanding skiing speed, Bø still finished fifth. None of the other top six biathletes missed more than one target.
Veteran Lukas Hofer was the only other athlete other than Fillon Maillet with a clear shooting performance, but eventually placed fourth, losing the medal due to slowing down on the track in the last third of the race.
"
