result_id,event_title,edition,edition_id,sport,sport_url,result_date,result_location,result_participants,result_format,result_detail,result_description
18000377,"Street, Women",2020 Summer Olympics,61,Skateboarding,/editions/61/sports/SKB,26 July 2021,"Ariake Urban Sports Park, Koto, Tokyo",20 from 13 countries,na,na,"Street is a discipline that focuses on flat ground tricks, grinds, slides and aerials within urban environments and, as such, obstacles like handrails, stairs and other street furniture are an integral part of the competitive sport. Each entrant had two 45 second runs in which to perform five individual tricks. The total score is taken by adding the four highest scores from the seven elements. The eight top highest scoring individuals qualified for the final.
The recent World Championships had been dominated by Japan and Brazil, who won the first six places on the podium and their success was expected to continue in Tokyo. Aori Nishimura of Japan took the world title and cemented her place as gold medal favourite with Brazil’s Rayssa Leal as her nearest rival.
The standard of competition in Tokyo was extremely variable and several top skateboarders, including Nishimura, failed to put together four scoring runs of any great quality. Japan’s strength in depth still resulted in a home champion being crowned in the shape of Momiji Nishiya. At 13 years 330 days, Nishiya was the youngest Summer Olympic champion since 1960 but was older than silver medallist Rayssa Leal. At 16, bronze medallist Funa Nakayama was the veteran of the podium. This set the record for the youngest Olympic podium in Olympic history.
"
481,"1,000 metres, Men",1992 Winter Olympics,44,Short Track Speed Skating,/editions/44/sports/STK,18 – 20 February 1992,"La Halle de Glace, Albertville",28 from 16 countries,"Placements 1-8 based on final and B final.  Deeper placements based on points earned in earlier rounds, and time in final round skated.",na,"The first Olympic short track event was expected to be a fight between the South Koreans - with 1990 World Champion Lee Jun-Ho and two time runner-up Kim Gi-Hun - and the reigning World Champion, Britain’s Wilf O’Reilly. All three favourites had seen earlier success at the Olympics. When short track was demonstrated in Calgary, O’Reilly had won the 500 and 1000 m, Kim had won the 1500 m and Lee the 3000 m.
The favourites all survived until the semi-finals. In the first heat, O’Reilly fell and finished last, while Lee and Mike McMillen both broke the World Record to qualify for the final. They were joined there by Kim and Canada’s Frédéric Blackburn. The two Koreans decided to make it a fast race, and went all out from the start. Blackburn and McMillen managed to cling on. Kim finished the race unchallenged in another World Record, while Blackburn passed Lee just in time for the silver medal. Kim became South Korea’s first ever Winter Olympic Champion, two days after the nation had gained its first ever Winter Olympic medal in speed skating.
"
54255,"Platform, Men",1992 Summer Olympics,23,Diving,/editions/23/sports/DIV,2 –  3 August 1992,"Piscina Municipal de Montjuïc, Barcelona",23 from 15 countries,10 metre platform.,na,"The two Chinese divers were favored. Xiong Ni was the defending champion and had been runner-up at the 1991 World Championships. But the winner at 1991 Worlds was his younger teammate Sun Shuwei, who had also won the 1990 Asian Games. Earlier in 1992, at Dive Canada, Sun had the highest single dive ever, to that time, scoring 102.00 for an inward 3½ tuck. The two led the qualifying with Xiong first.
In the final Sun took the lead on the last compulsory dive and held it to the end to win the gold medal, finishing with his inward 3½ tuck, on which he scored 99.96 points, the third highest scoring dive ever. The silver medal went to the surprisingly consistent American Scott Donie, who was little known prior to the US Olympic Trials, and took advantage of blown dives by the other contenders. Xiong went way over on a back 3½ tuck in the eighth round, which dropped him back to the bronze medal. The early leader in the final was German Jan Hempel, who over-rotated his eighth and ninth dives, dropping off the podium to finish fourth. The other American Matt Scoggin, who had won the US Trials, scored zero points on his seventh dive as he crashed into the water on his back after losing his handgrip while doing a back 3½ tuck (DD = 3.3) and eventually placed 10th.
This was the only Olympic appearance for Sun, who would win silver at the 1994 Worlds. Xiong added bronze in this event to his 1988 silver. He would later win three diving gold medals, springboard in 1996 and 2000, and synchro springboard in 2000.
"
15779,"Half-Lightweight (≤65 kilograms), Men",1980 Summer Olympics,20,Judo,/editions/20/sports/JUD,31 July 1980 — 10:00-19:00,"Dvorets sporta, Tsentralny stadion imeni V. I. Lenina, Moskva",29 from 29 countries,"Two single-elimination pools, with winner of each pool advanced to the final. All judoka losing to the winner of each pool advanced to repêchage pools, with the winners of the repêchage pools earning bronze medals.",na,"This was one class in which the world’s leading judoka was present. Nikolay Solodukhin (URS) had won the 1979 World Championships, but he was not present at the 1980 Europeans. In his opening round, he faced the 1976 gold medalist, Cuba’s Héctor Rodríguez and defeated him easily. In the other pool, the 1979 World runner-up, Yves Delvingt of France, was upset by Mongolia’s Damdin Tsendiin. The final matched Tsendiin and Solodukhin but it was not much of a match. Tsendiin spent the whole match running away from Solodukhin, avoiding ippon, and the decision was an easy one for the Soviet player.
"
350650,"10,000 metres, Men",2014 Winter Olympics,58,Speed Skating,/editions/58/sports/SSK,18 February 2014 — 17:00,"Adler-Arena, Coastal Cluster, Adler",14 from 9 countries,na,na,"Most people were looking at Sven Kramer to win the 10,000 m. After losing the gold due to an incorrect crossing at Vancouver, Kramer was looking for revenge, and his 5,000 m gold proved he was in shape. Kramer had also won the season’s only World Cup in this distance, although that race lacked his two main Dutch competitors, Jorrit Bergsma and Bob de Jong. Bergsma had beaten Kramer at the 2013 Worlds in Sochi, while De Jong - the 2006 champion - was competing in his fifth Olympics. Apart from the Dutchmen, defending Olympic champion Lee Seung-Hun and Belgian inline skater Bart Swings were considered for the medals. Several other contenders withdrew prior to the race. Russia’s Ivan Skobrev withdrew to focus on the team pursuit, as did the Norwegian entrants, who claimed the Dutch would be unbeatable. This earned the skaters a lot of criticism at home (from among others 1994 multiple Olympic champion Johann Olav Koss), especially after the bronze medal time turned out to be relatively weak and the Norwegian team failed to make the semi-finals in the team pursuit.
De Jong was the first of the favorites to skate, posting a stable and decent 13:07.19, but considering the track record stood 10 seconds faster, it seemed gold was out of the question. In the next pair, Bergsma and Swings raced each other. Bergsma departed with a 12:45 target time, which he managed with 12:44.45, a new lowland World Record and also a new Olympic Record. Swings had kept up with De Jong’s pace through 8,000 m, but eventually placed fifth. Bergsma’s time was comparable to Kramer’s 12:45.09 at the Dutch Olympic trials, which meant that the final pair would be exciting. Kramer took off a bit slower than Bergsma, but moved into first after 3,200 m. Kramer held on to his lead up until 3 laps before the finish, although gradually losing his lead in the previous laps. Knowing he couldn’t match Bergsma’s fast final laps, Kramer slowed down a little to finish second in 12:49.02. After the race, Kramer revealed he had been suffering from a recurring back injury since the Olympic 5,000 m. For the fourth time in Sochi, the speed skating podium was swept by Dutch skaters - a record in any winter sport.
Jorrit Bergsma had hoped to compete at the 2010 Olympics. Competing in the Dutch marathon skating circuit, with races of 40 km, his coach Jillert Anema noticed that Bergsma and several of his team mates should be able to beat the best team pursuit squads. As they were unable to enter the strong Dutch national team, Anema contacted the federation of Kazakhstan. Bergsma won the Kazakh national title in late 2009, but the necessary paperwork to also compete internationally was not completed in time, and Bergsma and his teammates gave up on their dream of Vancouver. Fortunately for Bergsma, his Olympic dreams still came through four years later.
"
4458,"100 yards Freestyle, Men",1904 Summer Olympics,3,Swimming,/editions/3/sports/SWM, 5 September 1904,"Life Saving Exhibition Lake, Forest Park, St. Louis",6 from 2 countries,na,na,"There were two heats in the 100-yard freestyle, which were won by Zoltán von Halmay and Charlie Daniels.  Six competitors reported for the finals, von Halmay and five Americans, led by Daniels and Scott Leary.  Although Leary had recently become the first man to swim a 100 yards under one minute, he was no match for von Halmay or Daniels and finished third.  Von Halmay easily defeated Daniels to win the race with ease.
"
19004404,"Flyweight (≤49 kilograms), Women",2020 Summer Olympics,61,Taekwondo,/editions/61/sports/TKW,24 July 2021,"Makuhari Messe, 2-1, Nakase, Mihama-ku, Chiba, Chiba Prefecture, Japan",17 from 17 countries,Single-elimination tournament. All fighters losing to the finalists in each pool advance to repêchage tournament for the bronze medal.,na,"Spain’s Adriana Cerezo beat the second seed, Serbia’s Tijana Bogdanović, in her first-round bout, and went on to reach the final against the top seed, Panipak Wongpattanakit of Thailand, who was also the 2015 and 2019 World Champion. The final was a very close bout, which Wongpattanakit won 11-10, thus becoming the first Olympic Taekwondo gold medal winner from Thailand, improving on the bronze medal she won at Rio. The 2008 and 2012 Olympic champion, Wu Jingyu from China, lost her quarter-final bout to Cerezo and then lost the repêchage to Bogdanović, who won one of the bronze medals, with the other bronze going to Israel’s Abishag Semberg.
"
29384,"Bantamweight (≤56 kilograms), Men",1968 Summer Olympics,17,Weightlifting,/editions/17/sports/WLF,13 October 1968 — 10:00-16:00,"Teatro de los Insurgentes, Ciudad de México",20 from 19 countries,"Total of best lifts in military press, snatch, and clean & jerk determined placement.  Ties broken by lightest bodyweight.",na,"This class brought together two of the greatest small lifters of the 1960s – Hungary’s Imre Földi and Iran’s Mohammad Nassiri. There had been no World Championships in 1967 but at the 1966 meet they had finished 2-3 behind the defending champion, Aleksey Vakhonin of the Soviet Union, but he was no longer on the Soviet team because of undisclosed transgressions. In his absence Nassiri and Földi fought it out with Földi leading after the press and snatch by 10 kg, but Nassiri called for 150 kg in the clean & jerk, 9 kg above his own world record, and successfully lifted it to tie Földi with 367.5 kg, equalling the world record. Based on bodyweight, Nassiri won the gold medal and Földi silver. In 1972 at München they would reverse those positions, with Földi winning gold. Nassiri’s 150 kg lift in the clean & jerk would not be bettered at the Olympics until 1980.
"
158775,"Eights, Women",1976 Summer Olympics,19,Rowing,/editions/19/sports/ROW,19 – 24 July 1976,"Bassin olympique, Île Notre Dame, Montréal, Québec",72 from 8 countries,na,na,"Women’s rowing events were new to the Olympic Games, but they had been contested at the European Championships since 1954 and the World Championships since 1974. The Europeans went extinct after 1973, making the Worlds the best metric through which to predict Olympic success. Thus, as with the rest of the women’s events, East Germany was lauded as the favorite, having won the last two editions of the tournament. The Soviet Union and the United States had been the runners-up in 1974 and 1975 respectively, while Romania had taken bronze on both occasions. The Soviet Union and East Germany won their heats in the opening round but, unlike most of the other events, there was no crew that was clearly dominant. The final, however, was slightly less competitive, with East Germany and the Soviet Union taking gold and silver by a comfortable margin. The race for bronze was more exciting, however, and saw the Americans slide to a slim victory ahead of a strong Canadian squad.
"
35641,"Hockey, Men",1956 Summer Olympics,14,Hockey,/editions/14/sports/HOC,23 November –  6 December 1956,"Melbourne Cricket Ground, Melbourne, Victoria / Olympic Park Stadium, Melbourne, Victoria",174 from 12 countries,Round-robin pools advance teams to classification round matches.,na,"Shortly before the opening ceremonies, the strong Dutch team withdrew due a boycott over the Hungarian Revolt, leaving the tournament with one less medal contender. The Melbourne Games did see the first Olympic hockey appearances of Australia and New Zealand, both future champions in the event. India breezed through the first round, with double digit victories over the United States and Afghanistan. The other top nations had a harder time reaching the next round, Britain needing a play-off against Australia, while Pakistan and Germany tied 0-0. Germany gave India a run for their money in the semis. Playing against a locked-down defense, India only managed to break the German lines once, late in the game. In the first ever hockey encounter between India and Pakistan, the Pakistani also showed that the gap between Indian hockey and the rest of the world was being closed fast. A single goal after the break gave India the advantage in the final, for their sixth consecutive gold medal.
"
353276,"Doubles, Men",2016 Summer Olympics,59,Tennis,/editions/59/sports/TEN,6 – 12 August 2016,"Centro Olímpico de Tênis, Parque Olímpico da Barra, Barra da Tijuca, Rio de Janeiro",64 from 26 countries,Single-elimination tournament.,na,"For the doubles qualification, the world ranking list was used with a maximum of two pairs per nation. The 24 best players qualified for Rio with eight more places being awarded by the International Tennis Federation. No two players from the same country started within the same section of the draw, which consisted of four sections of eight pairs, thus making it impossible for them to meet until the semi-finals.
As Bob and Mike Bryan withdrew from the men’s doubles for health reasons, Spain’s Rafael Nadal won his second Olympic gold medal when he partnered Marc López to victory over the Romanian pair Florin Mergea and Horia Tecău 6-2, 3-6, 6-4. The French pair Pierre-Hugues Herbert and Nicolas Mahut were the number one seeds but lost in the first round to Colombians Juan Sebastián Cabal and Robert Farah. Also, the number two seeds, brothers Andy and Jamie Murray surprisingly lost their first round match to the host nation’s duo of Thomaz Bellucci and André Sá by two tie-breaks.
"
920068,"Music, Compositions For Solo Or Chorus, Open1",1948 Summer Olympics,12,Art Competitions,/editions/12/sports/ART,29 July – 14 August 1948,"Victoria & Albert Museum, London",8 from 5 countries,na,na,"There is no known list of entrants for the 1948 music competitions, although it is known that Austria, Canada, Czechoslovakia, Denmark, Finland, France, Great Britain, Iceland, Ireland, Italy, Luxembourg and Poland sent a total of 36 entries. However, with few exceptions, only the prize winners are known in each category.
The event for vocals was a new one, replacing the event for solo and choirs with one intended for one or more solo voices. Only two entries are known: Gabriele Bianchi’s “Inno Olimpionico” (Olympic Hymn) and Ina Boyle’s “Lament for Bion.” Bianchi was a noted musical scholar, teaching at “Benedetto Marcello” in Venetia. The work of Ina Boyle, and eccentric but well-known Irish composer, received an honorable mention, despite the fact that it ostensibly had nothing to do with sport (the Bion in the work’s title is a Greek bucolic poet).
"
356710,"Middleweight (69-75 kilograms), Women",2016 Summer Olympics,59,Boxing,/editions/59/sports/BOX,14 – 21 August 2016,"Riocentro Pavilhão 6, Parque Olímpico da Barra, Barra da Tijuca, Rio de Janeiro",12 from 12 countries,Single elimination tournament.,na,"Claressa Shields had been utterly dominant in her division since winning the 2012 Olympic title and had never remotely looked like losing even a single bout since then. As such she arrived in Rio as world champion, top seed and one of the hottest favourites of the entire Games. She did not disappoint.
Three successive points victories gave Shields the gold in Rio as she defeated opponents from Russia and Kazakhstan before turning back the challenge of Dutch fighter Nouchka Fontijn in the final.
Fontijn fought bravely but could not match the accuracy or aggression of the 22-year-old from Flint, Michigan.
Shields was awarded the newly inaugurated women’s version of the Val Barker Trophy for the most stylish boxer of the 2016 Olympics. With her career record standing at 78 wins from 79 bouts in “amateur” boxing, she then felt it was time to jump to the pro ranks and made her professional debut in November 2016.
"
127221,"Super-Heavyweight, Greco-Roman (>100 kilograms), Men",1972 Summer Olympics,18,Wrestling,/editions/18/sports/WRE,6 – 10 September 1972,"Ringer-Judo-Halle, Messegelände (Halle 14), München",12 from 12 countries,"Scoring by negative points, with negative points given for any result short of a fall.  Accumulation of 6 negative points eliminated the wrestler.",na,"Soviet Anatoly Roshchin had won the silver medal in this class in 1964 and 1968, and was the World Champion in 1969-70, but he would be challenged by the 1971 World Champion, Bulgarian Aleksandar Tomov, who had already won the European Championship in 1972. After four rounds Roshchin and Tomov were left, along with Romanian Victor Dolipschi. Both defeated Dolipschi in the final round, and because of Roshchin’s victory over Tomov by decision in round two, the gold medal went to Roshchin. At 40-years-old he was the second oldest Olympic wrestling gold medalist, behind only 41-year-old Adolf Lindfors of Finland, who won in heavyweight Greco-Roman in 1920.
German Wilfried Dietrich also competed in this class, placing in a tie for fourth, after competing in the 1972 freestyle competition. This was his fifth Olympics and his eighth Olympic wrestling tournament. Several other wrestlers have competed in five Olympics, but Dietrich’s eight tournaments is an absolute Olympic best.
"
58345,"Discus Throw, Men",1936 Summer Olympics,11,Athletics,/editions/11/sports/ATH, 5 August 1936,"Olympiastadion, Reichssportfeld, Berlin",31 from 17 countries,na,na,"The dominant thrower in 1934-35 was Harald Andersson (SWE), who broke the world record twice in one day in 1934. Later in 1935 Germany’s Willy Schröder broke Andersson’s record. But neither man did well in Berlin. Andersson did not make the final, while Schröder would place only fifth. American Gordon Dunn moved into the lead with 49.36 (161-11½) in round two, with Italy’s surprising Giorgio Oberweger moving up to second in round three with 49.23 (161-6¼). Ken Carpenter produced the gold medal winning throw in round five with 50.48 (165-7½).
"
925999,"Driving Contest, Men",1904 Summer Olympics,3,Golf,/editions/3/sports/GLF,16 September 1904,"Glen Echo Country Club, Normandy",2 from 1 countries,na,na,na
328079,"Singles, Men",2012 Summer Olympics,54,Table Tennis,/editions/54/sports/TTE,28 July –  2 August 2012,"ExCeL, Newham, London (North Arena 1)",69 from 45 countries,Single-elimination tournament. Top 16 seeds advanced to round three. Seeds 17-32 advanced to round two.,na,"China had not been quite as dominant in the men’s table tennis singles event at the Olympics as they had in the women’s: although they too had swept the podium in 2008, they had failed to reach the final at the inaugural 1988 tournament, which was won by South Korea, and lost the crown to South Korea once more in 2004. Still, the nation had the top two seeds and its history of gold medal success in Olympic table tennis left them as the favorites for the top two spots. Zhang Jike, the reigning World Champion in both the singles and team events, was ranked number one while Wang Hao, the runner-up at the most recent World Championships and a two-time Olympic veteran with medals in the singles (silver in 2004 and 2008) and team (gold in 2008) events, was ranked number two. Wang was defeated in 2008’s all-China final by Ma Lin, but Ma had slipped in the rankings and a new rule from the International Table Tennis Federation, intended to curtail the nation’s dominance in the event, allowed for only two entrants per country in the tournament. This left Jun Mizutani of Japan, an Olympic veteran who had never won a major international singles medal, as the number three seed.
Both Zhang and Wang survived to the semi-finals, but Zhang struggled more along the way. While Wang gave up only two sets of fourteen, Zhang surrendered twice that many and, in a fourth round match against Bulgaria’s ninth-seeded Vladimir Samsonov, was at one point behind two sets to three. Zhang and Wang’s opponents in the semi-finals, eighth-seeded Dmitrij Ovtcharov of Germany and fifth-seeded Chuan Chih-Yuan of Chinese Taipei respectively, each fell in five sets, leading to the expected Chinese final. Despite his relative lackluster performance throughout the tournament, Zhang defeated Wang soundly and efficiently in the final, four sets to one, leading to an outcome that had seemed pre-ordained soon after the first set. The bronze medal match was somewhat more engaging, with Ovtcharov taking the first set and Chuan the next two. Ovtcharov then rallied, capturing the last three in mostly hard-won battles and earning the final podium spot. Although he had silver medals from the team events at the 2008 Summer Games and the 2010 and 2012 World Championships, his bronze in London was his first major international medal in the singles category.
"
29355,"Middle-Heavyweight (≤90 kilograms), Men",1964 Summer Olympics,16,Weightlifting,/editions/16/sports/WLF,17 October 1964 — 10:00-16:00,"Shibuya Kokaido, Shibuya, Tokyo",19 from 18 countries,"Total of best lifts in military press, snatch, and clean & jerk determined placement.  Ties broken by lightest bodyweight.",na,"Arkady Vorobyov had won the gold medal in this class in 1956-60, but had now retired and was coaching the Soviet team. Britain’s Louis Martin, the 1960 bronze medalist, had won the 1962-63 World Championships and held the world record and was favored, with Poland’s Ireneusz Paliński, 1961 World Champion and runner-up to Martin in 1962-63, considered his biggest challenger. Nobody expected much from Soviet Vladimir Golovanov, who had little international reputation, and had never even won a national title. However, Golovanov lifted 165.0 kg in the press to lead, and also had the best snatch with 142.5 kg, equalled by Hungarian Árpád Nemessányi. When Golovanov jerked 180.0 kg, he set a world record total of 487.5 kg to win gold in a big upset. Martin was never really close, but also lifted 180.0 kg in the clean & jerk to take silver, with Paliński getting bronze.
"
154284,"1,000 metres Time Trial, Men",1976 Summer Olympics,19,Cycling Track,/editions/19/sports/CTR,20 July 1976 — 15:00,"Vélodrome olympique, Parc olympique, Montréal, Québec",30 from 30 countries,na,na,"The early leader was Belgium’s 18-year-old national champion Michel Vaarten. When defending champion Niels Fredborg (DEN) came in slower, his chances for a medal seemed good. But the last two World Champions, Klaus-Jürgen Grünke (GDR-1975) and Eduard Rapp (URS-1974), were late starters and Vaarten had a long wait. Rapp was first to start among the favorites. When he started he thought he had taken off before the gun and sat up, thinking he would be given a re-start. But the officials ruled his start to be legal, and he was disqualified. Grünke started somewhat slowly, his early splits trailing those of Vaarten, but he was much stronger over the last half of the race, and won the gold medal by almost 1.6 seconds. Vaarten held on for the silver medal, with Fredborg completing his medal set in this event, adding bronze to his 1972 gold and 1968 silver. As a pro, Vaarten later placed second in the points race at the 1986 World Championships.
"
