result_id,event_title,edition,edition_id,sport,sport_url,result_date,result_location,result_participants,result_format,result_detail,result_description
22163,"Light-Heavyweight (≤175 pounds), Men",1936 Summer Olympics,11,Boxing,/editions/11/sports/BOX,10 – 15 August 1936,"Deutschlandhalle, Berlin",21 from 21 countries,Single elimination tournament.,na,"Roger Michelot of France, who had reached the middleweight semi-finals in Los Angeles, returned for another attempt at Olympic glory and was amongst those touted for success in a division which had a number of contenders but no clear favourite. One of those contenders, Carl Vinciquerra, the US national amateur champion was the victim of a major shock in the opening round, the unheralded Egyptian fighter Mohamed Amin defeating him on points.
The final matched Michelot with Germany’s Richard Vogt and at first it appeared as Vogt was to cruise to victory. The German’s superior reach dominated the first three minutes and he took the round clearly. It was then that Michelot put his experience to work, punishing Vogt for his overconfidence and changing the course of the fight. An attack by Vogt had Michelot reeling in the last few moments of the fight but the Frenchman had done enough to win the championship.
Vogt had a professional career with included three separate reigns as German light-heavyweight champion. An attempt at the European title was lost but he did have the distinction of being the man who ended the career of former heavyweight champion Max Schmeling. Robey Leibbrandt of South Africa, who defaulted through injury from the bronze medal match, served seven years in prison in his native country. He was convicted of treason after working as an agent for the Nazis.
"
1894,"50 kilometres, Men",1932 Winter Olympics,31,Cross Country Skiing,/editions/31/sports/CCS,13 February 1932 — 8:00,"James C. Sheffield Speed Skating Oval, Lake Placid",32 from 9 countries,na,"Course Length: 48,239 mHeight Differential: ?Maximum Climb: ?Total Climbing: ?","One of the big problems for the organizers of the 1932 Winter Games was the lack of snow. The mild weather during and after the 18 km. race melted the snow away in the open areas, and only in the forest was there enough snow to make a cross country track. Therefore it was decided to make a 25 km. track for the 50 km., to be skied in two laps, with the start and finish area moved into the forest, several kilometers away from the nearest dwellings. During the race the temperature was around zero, and the conditions were acceptable in spite of the thin layer of snow.
Early on it turned out to be a Finnish day. At the first lap Veli Saarinen was in the lead, one minute in front of his countryman Väinö Liikkanen, followed by Sweden’s Sven Utterström and three Norwegians: Arne Rustadstuen, Sigurd Vestad and Ole Hegge, who was 5th at the distance in St. Moritz four years earlier. Hegge had already lost five minutes to the leader Saarinen. On the second lap Utterström faded. At the end an exhausted Saarinen was able to cling to the lead ahead of fast finishing Liikkanen and won by a margin of 20 seconds. Hegge had the fastest second lap of all skiers, but was not able to catch Rustadstuen in the battle for the bronze medal. Rustadstuen started three minutes behind Hegge, and was able to better his countryman’s time by 11 seconds.  Veli Saarinen’s gold medal was the first ever won by a Finn in an Olympic skiing event.
"
1558,"3 × 7.5 kilometres Relay, Women",1992 Winter Olympics,44,Biathlon,/editions/44/sports/BTH,14 February 1992 — 10:00,Les Saisies,48 from 16 countries,Eight shots for each group of five targets. Penalty loop (150 metres) skied for each missed target.,"Course Length: 7,350 mHeight Differential: 57 mMaximum Climb: 39 mShooting 1: Prone at 2.5 km, 50 m rangeShooting 2: Standing at 5.0 km, 50 m rangeTotal Climbing: 279 m","Since women first competed at the biathlon World Championships in 1984, the relay had always been won the Soviet team. Norway and Sweden had usually fought out the other medals, although Finland had won two medals, and Czechoslovakia, Bulgaria, Germany and the United States had won one medal each. The Unified Team was favored in the absence of the defunct Soviet Union. But on the first leg, France took the lead, shooting cleanly, while both Yelena Belova (EUN) and Uschi Disl (GER) missed a target, dropping their teams to third and fourth respectively, also trailing Bulgaria. France was unknown in women’s biathlon prior to the 1991-92 season but they had won the last World Cup race prior to the Albertville Games. Anfisa Reztsova put the Unified Team ahead after the second leg, followed by Germany and France, as the world order was restored. But the final leg brought a shocker, as Anne Briand-Bouthiaux had the fastest leg by over 45 seconds to bring France a surprising gold medal. This was especially surprising as one of France’s best biathletes, Delphine Heymann-Burlet, had to miss the event because of illness. Germany’s Petra Schaaf moved her team up to second, with the Unified team winning the bronze medal.
"
259970,"Parallel Bars, Men",2008 Summer Olympics,53,Artistic Gymnastics,/editions/53/sports/GAR,9 – 19 August 2008,"Guojia Tiyuguan, Beijing Aolinpike Gongyuan, Beijing",76 from 27 countries,na,na,"The format was the same as it had been from 1984-2004, with eight gymnasts advancing from the team all-around, but no more than two per nation. Gold in this event went to China’s Li Xiaopeng who had also won the Olympic gold medal in 2000 at Sydney. His staggered victories made him the first Olympic gymnast ever to win an individual event twice, but not consecutively. Li had been hampered by foot and ankle injuries since 2000, finally undergoing surgery in 2006. The silver went to Korean Yon Won-Cheol, the 2006 silver medalist at the Worlds. Slovenian Mitja Petkovšek, the 2005 and 2007 World Champion on parallel bars, was not at his best in Beijing, placing fifth in qualifying and the final round.
"
10786,"One Person Dinghy (Laser), Open",2000 Summer Olympics,25,Sailing,/editions/25/sports/SAL,20 – 29 September 2000,"Rushcutters Bay Marina, Rose Bay, New South Wales",43 from 43 countries,Points awarded for placement in each race.  Best nine of eleven scores to count for final placement.,na,"In 1996 Brazilian Robert Scheidt had won this event, defeating the British silver medalist, Ben Ainslie. This ignited a rivalry between them with Scheidt defeating Ainslie at the 1997 and 2000 World Championships and Ainslie defeating Scheidt in 1999. In Sydney Scheidt led Ainslie by seven points going into the final race. The only way Ainslie could win was for Scheidt to finish 22nd or higher. Ainslie resolved to win by harassing Scheidt. At the start he forced him into a penalty turn. After the start, Ainslie continually blocked Scheidt’s wind and prevented him from passing. Scheidt eventually made an incorrect turn and hit Ainslie’s boat, allowing Scheidt to get ahead but he could only finish 22nd and the gold medal went to Ainslie. Well, it did, after Scheidt’s two protests against Ainslie were turned down, and, eventually, Scheidt was disqualified for hitting Ainslie. Ainslie’s tactics were tough, but legal.
The two would continue to compete against one another. At the 2012 Olympics, both won their fifth Olympic medals, equalling the record of Brazilian Torben Grael. This was also the first of four consecutive gold medals for Ainslie, who would soon switch to the Finn for the next three gold medals, equalling the Olympic best of Dane Paul Elvstrøm. After Ainslie switched to Finn, Scheidt won the 2004 Laser gold medal, and then switched to the Star class.
"
2210,"Individual, Men",1952 Winter Olympics,34,Nordic Combined,/editions/34/sports/NCB,17 – 18 February 1952,"Holmenkollbakken, Oslo / Holmenkollen Langrennssentret, Oslo",25 from 11 countries,Normal hill ski jumping and 18 kilometres skiing; placements determined by points table.,na,"The Olympic Champion from 1948, Heikki Hasu, won another gold medal at the World Championships in Lake Placid in 1950, but this time things went better for the Norwegians: Ottar Gjermundshaug placed second and Simon Slåttvik third, the other Norwegians placing fourth and sixth. Slåttvik had emerged as Hasu’s closest rival, winning the prestigious Holmenkollen Nordic Combined both in 1950 and 1951 and beating Hasu on both occations. In 1950 is was a very close contest, but in 1951 Hasu fell in two of his three jumps and was out of contention for the victory. Slåttvik had now moved from his birthplace in Nordland to Lillehammer, which made it much easier for him to train and participate in important competitions.
At the Olympic Games in Oslo, the schedule of events for the Nordic Combined had changed. For the first time the ski jumping was the first part of the competition, and the 18 km cross-country part was scheduled the day after, and as usual combined with the specialist’s race.
The audience of almost 30,000 held their breath when home favorite Slåttvik fell in his first jump measuring 67.5 m, the longest in the first round. The two best jumps of three counted, and the pressure was on Slåttvik. He produced two excellent jumps in superb style and ended as winner of the jumping event, 0.5 point better than his countryman Sverre Stenersen, a 25-year-old newcomer to the team and like Slåttvik also from the northern part of Norway. Stenersen had the longest jump of the day, jumping 69.5 m in the third round. Hasu, however, jumped better than expected and placed fifth in the event. He had to beat Slåttvik by 4:32 minutes in the cross-country, and that was considered quite possible since Hasu was an excellent cross-country skier, a medal candidate among the specialists.
Hasu again made an excellent 18 km, missing the bronze medal among the specialist with only 4 seconds and beating his closest rival among the Nordic Combined participants, his countryman Paavo Korhonen, by over three minutes. Slåttvik, however, made his best cross-country competition ever. With massive support from an enthusiastic home crowd, he crossed the finish line with a time only 3:16 behind Hasu, placing third in the cross-country and winning the Olympic gold with a clear margin. Stenersen was able to keep ahead of Korhonen and secured the bronze, even if he was beaten by Hasu by over seven minutes.
"
102211,"Sabre, Team, Men",1976 Summer Olympics,19,Fencing,/editions/19/sports/FEN,26 – 27 July 1976,"Stade d'Hiver de l'Université de Montréal, Montréal, Québec",63 from 14 countries,na,na,"As World Champions the Soviet Union were always going to be the favourites for the Olympic title in 1976. After the individual championships held a few days earlier had produced a 1-2-3 for the Soviets this favourite’s role became overwhelming. The USSR started off with a series of overwhelming victories before their title aspirations nearly come unstuck against Romania in the semi-final. The match ended in an 8-8 tie which turned into a defeat for the Romanian by a single hit when the tiebreaker rules were invoked. The Soviets then regrouped and went on to win a comfortable victory over Italy in the Olympic final.
"
63118,"4 x 100 metres Relay, Women",1984 Summer Olympics,21,Athletics,/editions/21/sports/ATH,11 August 1984,"Los Angeles Memorial Coliseum, Los Angeles, California",45 from 11 countries,na,na,"With the Soviet boycott, the best team in the world, the GDR (East Germany), was not present. They had won the 1983 World Championships and the 1982 European Championships, and had set the last eight world records, the most recent one in July 1983. In their absence, the United States was favored in front of the home crowd. Jamaica had won the bronze medal at the 83 Worlds, but dropped the baton on the first exchange of the final. They finished the race but were never a factor. Great Britain had been silver medalists at the 1983 World Championship, but the United States simply ran away from everyone, with 100 champion Evelyn Ashford running the anchor leg. The time of 41.65 was the fastest ever by a non-GDR team.
"
1932,"10 kilometres, Women",1960 Winter Olympics,36,Cross Country Skiing,/editions/36/sports/CCS,20 February 1960,"McKinney Creek Stadium, Tahoma, California",24 from 7 countries,na,Course Length: ?Height Differential: ?Intermediate 1: 5.0 kmMaximum Climb: ?Total Climbing: ?,"The Soviet ladies had dominated this event since they made their first appearance in the 1954 World Championships, winning all the gold medals since then. At the World Championships in 1958 they won gold and silver, with Alevtina Kolchina the winner ahead of defending Olympic Champion Lyubov Kozyreva, who was entered for Squaw Valley under her new married name Baranova.
The 1960 10 km race was totally dominated by the Soviet ladies. At the halfway point, defending champion Baranova was in the lead, 15 seconds ahead of World Champion Kolchina. But Mariya Gusakova, sixth in the 1958 World Championships and 23 seconds behind the leader at 5 km, had the strongest finish of all and won by a comfortable margin, 18 seconds ahead of Baranova. Radiya Yeroshina, silver medalist from 1956, finished six seconds ahead of Kolchina and secured the bronze medal. The bronze medalist from 1956, now competing under her married name Sonja Ruthström, was the best non-Soviet skier in fifth place, 23 seconds behind Kolchina. The youngest competitor in the field of 24, Bulgarian Krastana Stoeva, was best of the Middle Europeans, placing ninth.
Two days after Gusakovas’s Olympic triumph, her husband Nikolay Gusakov won the bronze medal in Nordic Combined.
"
158793,"Double Sculls, Men",1980 Summer Olympics,20,Rowing,/editions/20/sports/ROW,20 – 27 July 1980,"Grebnoy kanal, Sportivny komplex Krylatskoye, Moskva",19 from 9 countries,na,na,"Norway’s participation in the American-led boycott meant that whoever won the men’s double sculls event at the 1980 Summer Olympics would earn a qualified victory at best. This was due to the fact that brothers Frank and Alf Hansen, the defending Olympic champions and winners of three of the last four World Championships, were excluded from competing. This meant that the only World Champion at the Games was Chris Baillieu of Great Britain, one half of the 1977 championship duo and runner-up at the 1976 Olympics. Baillieu was considered a slight favorite, however, even without his traditional partner Mike Hart, because he had won three of the last four Double Challenge Sculls at the Henley Royal Regatta. In Moscow he was partnered with Jim Clark, a 1976 silver medalist in the coxed eights.
The opening round, however, was dominated by East Germany, who finished nearly five seconds ahead of the other heat winner, Great Britain. The German pair consisted of Joachim Dreifke, bronze medalist from the 1976 Olympic single sculls and half of the 1975 World runners-up, and Klaus Kröppelien, a successful international rower in other disciplines. In the final, the East Germans claimed gold by a comfortable margin, leaving silver and bronze for Yugoslavia and Czechoslovakia respectively. The former’s crew consisted of Zoran Pančić and Milorad Stanulov, a bronze medalist in the single sculls at the 1978 World Championships, while the latter was represented by Zdeněk Pecka and Václav Vochoska, both 1976 Olympic bronze medalists in the quadruple sculls. Great Britain, meanwhile, faltered in the final and finished fourth.
"
925419,"French Skiffs, Coxless Fours (Instructors of Gymnastics School Joinville-le-Pont), Men",1900 Summer Olympics,2,Rowing,/editions/2/sports/ROW,14 August 1900,"Marne, Joinville-le-Pont",12 from 1 countries,na,na,na
925879,"120 yards Hurdles - Western AAU Championship, Men",1904 Summer Olympics,3,Athletics,/editions/3/sports/ATH,30 July 1904,"Francis Field, Washington University, St. Louis",2 from 1 countries,na,na,na
60893,"800 metres, Women",1968 Summer Olympics,17,Athletics,/editions/17/sports/ATH,17 – 19 October 1968,"Estadio Olímpico Universitario, Ciudad de México",24 from 16 countries,na,na,"The favorite in 1968 was Vera Nikolić of Yugoslavia, who was the world record holder (2:00.5) and had won the 1966 European Championship. She won the first heat in round one. In the semi-final, she led for 300 metres and then oddly stepped off the track, walking back to the start line where she sat down and took off her shoes. There were many explanations given, but the actual reasons are not known. Some said she was overcome by psychological pressure, driven too hard by her coach, while others said the rarified air of México had her struggling for oxygen. But with Nikolić out, the way was open for America’s Madeline Manning, who had won the 1967 AAU in 2:03.6. But the favorite’s in the final probably fell to Dutchwoman Mia Gommers. In the final Manning went to the lead at the bell and nobody could pass her, as she won by almost 15 metres in an Olympic record 2:00.9. Romania’s Ileana Silai edged Gommers for the silver.
"
350028,"10 kilometres Pursuit, Women",2014 Winter Olympics,58,Biathlon,/editions/58/sports/BTH,11 February 2014 — 19:00,"Kompleks Dlya Sorevnovaniy Po Lyzhnym Gonkam i Biatlonu Laura, Mountain Cluster, Krasnaya Polyana",57 from 23 countries,Starting margin based on results of 7.5 kilometer. Penalty loop (150 metres) skied for each missed target.,"Course Length: 9,897 mHeight Differential: 29 mMaximum Climb: 28 mShooting 1: Prone at 1.992 km, 50 m rangeShooting 2: Prone at 3.943 km, 50 m rangeShooting 3: Standing at 5.894 km, 50 m rangeShooting 4: Standing at 7.946 km, 50 m rangeTotal Climbing: 295 m","On her final bullet, Darya Domracheva finally missed a target. But by that time, it did not matter as the Belarus biathlete had secured gold in the women’s 10 km pursuit by putting almost 38 seconds between herself and the rest of the field at the Laura Biathlon Center. Domracheva worked her way through the field from a ninth place start, and a 32-second deficit. She stood in second place at the end of the first lap but eventually moved up to secure the gold. Norwegian Tora Berger began in 10th place, but claimed the silver medal after hitting 19 of 20 targets. In a surprise, Slovenian Teja Gregorin won bronze by shooting cleanly in the fourth and final round, after starting the race in 15th spot, and became the first Slovenian to win an Olympic medal in biathlon
"
1609,"10 kilometres Pursuit, Women",2006 Winter Olympics,49,Biathlon,/editions/49/sports/BTH,18 February 2006 — 12:30,Cesana San Sicario,58 from 22 countries,Starting margin based on results of 7.5 kilometer. Penalty loop (150 metres) skied for each missed target.,"Course Length: 10,000 mHeight Differential: 41 mMaximum Climb: 13 mShooting 1: Prone at 2.0 km, 50 m rangeShooting 2: Prone at 4.0 km, 50 m rangeShooting 3: Standing at 6.0 km, 50 m rangeShooting 4: Standing at 8.0 km, 50 m rangeTotal Climbing: 340 m","The very close finish in the sprint, with the top eight finishers within 22 seconds of one another, meant that this race would also have a lot of contenders. The race was on a course that had seen a snowfall the night before, making for difficult ski conditions. Germany’s Uschi Disl was the defending World Champion, and was trying to finally win an individual Olympic gold medal. But she started almost two minutes back and could only get up to 10th. The sprint champion, France’s Florence Baverel-Robert, was done in by poor shooting, missing four targets. Despite the closeness of the start, the event would be a runaway for German Kati Wilhelm. Starting only 18 seconds back, she took the lead early and pushed ahead, missing only one target, and winning by 1:13.6 over her teammate Martina Glagow. The bronze went to Russian Albina Akhatova, and Glagow and Akhatova had finished in the same positions in the 15 km individual, although only after the doping disqualification of Olga Pyleva. This was Wilhelm’s third Olympic gold medal, after sprint and relay golds in 2002, and she would add two more silvers in Torino, in the pursuit and relay.
"
925747,"High Jump - AAU Junior Championship, Boys",1904 Summer Olympics,3,Athletics,/editions/3/sports/ATH, 3 June 1904,"Francis Field, Washington University, St. Louis",3 from 1 countries,na,na,na
61005,"100 metres, Men",1972 Summer Olympics,18,Athletics,/editions/18/sports/ATH,31 August –  1 September 1972,"Olympiastadion, Olympiapark, München",85 from 55 countries,na,na,"For the first time ever, there was a favorite who was not an American. Soviet Valery Borzov had shown promise when he won the 1968 European Junior double over 100/200. The next year he won the European 100, and in 1971 he won the sprint double at the European Championships. Borzov also posted a succession of top times and defeated several American sprinters in international dual meets. The top American coming since Mexico City was the 1968 200 metre silver medalist, John Carlos, but turned to pro football, and was ineligible due to amateur rules. He tried out for the Philadelphia Eagles and then played in Canada with the Montreal Alouettes. The US Olympic Trials put forward three good sprinters in Eddie Hart, Rey Robinson, and Robert Taylor. In the final of that event Hart and Robinson equaled the world record of 9.9.
In München all the favorites got thru the first round. The quarter-finals were later that day and the Americans went back to the Olympic Village to rest up. While there, they noticed something unusual while watching some of the events on television. It appeared that the 100 metre quarter-finals were beginning at the stadium – and they were not there! They rushed to the stadium, hoping to make it in time for their heats, but both Hart and Robinson were too late. Taylor was in the third heat and barely made it in time, qualifying for the semi-finals, just behind Borzov. The US Olympic Committee appealed the disqualification of Hart and Robinson, but to no avail – they were out. It turned out that US track coach Stan Wright was going by an outdated schedule that showed the quarter-finals starting at 6 PM (1800), instead of their actual 4 PM (1600) start time. With the two main Americans out, the road was clear for Borzov, although it is likely he would have won the gold medal even if they had run. He won fairly easily in the final with Taylor second, followed by 1968 silver medalist Lennox Miller. Three days later, Borzov ran in the 200 metre final, which was actually his best distance, and completed the sprint double, the first non-American to do that since Percy Williams (CAN) in 1928.
"
70679,"Floor Exercise, Women",1992 Summer Olympics,23,Artistic Gymnastics,/editions/23/sports/GAR,28 July –  1 August 1992,"Palau Sant Jordi, Barcelona",92 from 24 countries,na,na,"Eight gymnasts advanced to the final round based on the qualifying scores in the team all-around, but the final placements were determined only by the score posted in the final round. Romanians Lavinia Miloşovici and Christina Bontaş led the qualifying, but Miloşovici scored a perfect 10 in the final to take the gold medal. Second was Hungarian Henrietta Ónodi, while the bronze was a three-way tie between Bontaş, American Shannon Miller and Unified Team member Tetiana Hutsu. Svetlana Boginskaya had been tied for first in qualifying, but was replaced by her Unified teammate, Oksana Chusovitina, who had been 1991 World Champion, although she finished only seventh in the final.
"
905001,"Ski Joring, Men",1928 Winter Olympics,30,Skijoring,/editions/30/sports/SJR,12 February 1928,"Sankt Moritzersee, St. Moritz",8 from 2 countries,na,na,"Skijoring is a primarily Scandanavian sport, in which a person on skis is towed by dogs or horses, or sometimes by a snowmobile. It was held several times at the Nordic Games (1901, 1905, 1909), which were the early forerunners of the Winter Olympics. In 1928 at St. Moritz the sport was contested as a demonstration event with the skiiers towed by horses. It was held on a frozen lake, with eight competitors starting in a mass start race. Little else is known of the event and it was never contested again at the Winter Olympics as a demonstration sport.
"
